{
    "type": "visual_dsl",
    "id": "visual-phase0-main",
    "show_id": "show-phase0-minimal",
    "scenes": [
        {
            "scene_id": "scene_intro",
            "program_ref": "glsl/scene-intro",
            "output_backend": "fake_visual_backend",
            "display_topology_ref": "flat-display-a",
            "uniform_defaults": {
                "tint": "blue"
            }
        },
        {
            "scene_id": "scene_drop",
            "program_ref": "glsl/scene-drop",
            "output_backend": "fake_visual_backend",
            "display_topology_ref": "flat-display-a",
            "uniform_defaults": {
                "tint": "amber"
            }
        }
    ]
}